{
  "id": "gp32",
  "name": "GamePark GP32",
  "category": "handheld",
  "manufacturer": "GamePark",
  "sources": [{ "type": "docs", "url": "https://docs.mamedev.org/", "last_reviewed": "2026-04-29", "confidence": "medium" }],
  "formats": { "preferred": [".fxe"], "supported": [".fxe", ".zip", ".7z", ".bin"], "descriptor_files": [], "archive_formats": [".zip", ".7z"] },
  "bios": { "required": false, "common_files": [], "notes": "GP32 launch behavior can depend on firmware/runtime expectations and homebrew packaging." },
  "emulation": { "preferred_emulators": ["mame"], "retroarch_cores": ["mame"] },
  "library_behavior": { "multidisc": false, "multidisc_format": null, "folder_based": true, "playlist_target_preference": "FXE executable or package folder", "safe_archive_deletion_requires_launch_test": true },
  "safety": { "automation_level": "dry_run_only", "requires_backup": true, "do_not_store": ["firmware", "rom_payloads"], "notes": ["Do not flatten packages with sidecar data automatically."] },
  "notes": ["Homebrew/package layout can matter more than extension matching."]
}
