{
  "id": "ngpc",
  "name": "Neo Geo Pocket Color",
  "category": "handheld",
  "manufacturer": "SNK",
  "sources": [
    {
      "type": "docs",
      "url": "https://docs.libretro.com/library/race/",
      "last_reviewed": "2026-04-29",
      "confidence": "medium"
    },
    {
      "type": "docs",
      "url": "https://mednafen.github.io/documentation/",
      "last_reviewed": "2026-04-29",
      "confidence": "medium"
    }
  ],
  "formats": {
    "preferred": [
      ".ngc",
      ".ngp"
    ],
    "supported": [
      ".ngp",
      ".ngc",
      ".zip",
      ".7z"
    ],
    "descriptor_files": [],
    "archive_formats": [
      ".zip",
      ".7z"
    ]
  },
  "bios": {
    "required": false,
    "common_files": [],
    "notes": "Neo Geo Pocket Color cartridge emulation generally does not require BIOS files."
  },
  "emulation": {
    "preferred_emulators": [
      "mednafen",
      "race"
    ],
    "retroarch_cores": [
      "mednafen_ngp",
      "race"
    ]
  },
  "library_behavior": {
    "multidisc": false,
    "multidisc_format": null,
    "folder_based": false,
    "playlist_target_preference": "cartridge ROM file",
    "safe_archive_deletion_requires_launch_test": true
  },
  "safety": {
    "automation_level": "dry_run_only",
    "requires_backup": true,
    "do_not_store": [
      "rom_payloads"
    ],
    "notes": [
      "Do not merge ngp and ngpc folders without user confirmation."
    ]
  },
  "notes": [
    "Alias-like normalized record for frontends that split NGPC from the broader ngp family record."
  ]
}
