{
  "id": "intellivision",
  "name": "Intellivision",
  "category": "console",
  "manufacturer": "Mattel",
  "sources": [{ "type": "docs", "url": "https://docs.libretro.com/library/freeintv/", "last_reviewed": "2026-04-29", "confidence": "medium" }, { "type": "docs", "url": "https://docs.mamedev.org/", "last_reviewed": "2026-04-29", "confidence": "medium" }],
  "aliases": { "folder_ids": ["intellivision", "intv"], "frontend_ids": ["intellivision"], "region_ids": [], "equivalent_system_ids": [] },
  "formats": { "preferred": [".int", ".rom"], "supported": [".int", ".bin", ".rom", ".zip", ".7z"], "descriptor_files": [], "archive_formats": [".zip", ".7z"] },
  "bios": { "required": true, "common_files": ["exec.bin", "grom.bin"], "notes": "EXEC/GROM files are user-managed BIOS data and must not be stored in project data." },
  "emulation": { "preferred_emulators": ["freeintv", "mame"], "retroarch_cores": ["freeintv", "mame"] },
  "library_behavior": { "multidisc": false, "multidisc_format": null, "folder_based": false, "playlist_target_preference": "cartridge ROM file" },
  "frontend_notes": {},
  "safety": { "automation_level": "dry_run_only", "requires_backup": true, "do_not_store": ["bios_roms", "rom_payloads"], "notes": ["Do not infer BIOS correctness from filename alone."] },
  "notes": ["Controller overlays and metadata can matter for usability but should remain separate from ROM repair."]
}
