{"id":"gb2players","name":"Game Boy 2 Players","category":"handheld","manufacturer":"Nintendo / frontend bucket","sources":[{"type":"docs","url":"https://docs.libretro.com/","last_reviewed":"2026-04-29","confidence":"low"}],"formats":{"preferred":[".gb",".gbc"],"supported":[".gb",".gbc",".sgb",".bin",".rom",".zip",".7z",".iso",".chd"],"disc_formats":[".iso",".chd"],"archive_formats":[".zip",".7z"]},"bios":{"required":false,"common_files":[],"notes":"GB/GBC BIOS files are optional in many emulators and must not be stored by rom-librarian."},"emulation":{"preferred_emulators":["retroarch","sameboy","gambatte"],"retroarch_cores":["sameboy","gambatte"]},"library_behavior":{"multidisc":false,"multidisc_format":null,"folder_based":false,"playlist_target_preference":"ROM image or frontend multiplayer launcher","safe_archive_deletion_requires_launch_test":true},"safety":{"automation_level":"approval_required","requires_backup":true,"do_not_store":["bios_files","save_data"],"notes":["Multiplayer bucket behavior may depend on frontend-specific launch options."]},"notes":["Frontend multiplayer naming bucket; avoid treating it as a separate canonical ROM format."]}
