{
  "id": "daphne",
  "name": "Daphne Laserdisc",
  "category": "laserdisc",
  "manufacturer": "Daphne community",
  "sources": [{ "type": "homepage", "url": "https://github.com/DirtBagXon/hypseus-singe", "last_reviewed": "2026-04-29", "confidence": "medium" }],
  "aliases": { "folder_ids": ["daphne"], "frontend_ids": ["daphne"], "region_ids": [], "equivalent_system_ids": [] },
  "formats": { "preferred": [".daphne"], "supported": [".daphne", ".zip", ".m2v", ".ogg", ".dat"], "descriptor_files": [".daphne", ".dat"], "archive_formats": [".zip"] },
  "bios": { "required": false, "common_files": [], "notes": "Daphne/Hypseus games often need ROM ZIPs plus video/audio/framefile assets rather than BIOS files." },
  "emulation": { "preferred_emulators": ["hypseus-singe", "daphne"], "retroarch_cores": [] },
  "library_behavior": { "multidisc": false, "multidisc_format": null, "folder_based": true, "playlist_target_preference": "Daphne folder/descriptor with matching media assets", "safe_archive_deletion_requires_launch_test": true },
  "frontend_notes": {},
  "safety": { "automation_level": "approval_required", "requires_backup": true, "do_not_store": ["rom_payloads", "commercial_video_assets"], "notes": ["Do not move video/audio/framefile assets independently; relative paths are launch-critical."] },
  "notes": ["Laserdisc libraries need sidecar media audits before any repair plan."]
}
