{
  "id": "ios",
  "name": "iOS IPA",
  "category": "mobile",
  "manufacturer": "Apple",
  "sources": [
    {
      "type": "github",
      "url": "https://github.com/touchHLE/touchHLE",
      "last_reviewed": "2026-04-29",
      "confidence": "medium"
    }
  ],
  "aliases": {
    "folder_ids": [
      "ios",
      "iphone",
      "ipad"
    ],
    "frontend_ids": [
      "ios"
    ],
    "region_ids": [],
    "equivalent_system_ids": []
  },
  "formats": {
    "preferred": [
      ".ipa"
    ],
    "supported": [
      ".ipa",
      ".zip"
    ],
    "descriptor_files": [],
    "archive_formats": [
      ".zip"
    ]
  },
  "bios": {
    "required": false,
    "common_files": [],
    "notes": "Early iOS app compatibility depends on runtime support, signing/DRM state, and bundled assets rather than BIOS files."
  },
  "emulation": {
    "preferred_emulators": [
      "touchhle"
    ],
    "retroarch_cores": []
  },
  "library_behavior": {
    "multidisc": false,
    "multidisc_format": null,
    "folder_based": true,
    "playlist_target_preference": "IPA package or launcher entry",
    "safe_archive_deletion_requires_launch_test": true
  },
  "frontend_notes": {},
  "safety": {
    "automation_level": "approval_required",
    "requires_backup": true,
    "do_not_store": [
      "account_data",
      "tokens",
      "license_keys",
      "save_data",
      "rom_payloads"
    ],
    "notes": [
      "Do not resign, decrypt, or modify IPA contents automatically."
    ]
  },
  "notes": [
    "Treat iOS app libraries as compatibility/launcher targets with legal and DRM caveats."
  ]
}
