{
  "id": "lutris",
  "name": "Lutris",
  "category": "launcher",
  "manufacturer": "Lutris community",
  "sources": [{ "type": "homepage", "url": "https://lutris.net/", "last_reviewed": "2026-04-29", "confidence": "medium" }],
  "aliases": { "folder_ids": ["lutris"], "frontend_ids": ["lutris"], "region_ids": [], "equivalent_system_ids": [] },
  "formats": { "preferred": [".yml", ".yaml", ".desktop"], "supported": [".yml", ".yaml", ".json", ".desktop", ".sh"], "descriptor_files": [".yml", ".yaml", ".json", ".desktop", ".sh"], "archive_formats": [] },
  "bios": { "required": false, "common_files": [], "notes": "Lutris manages launchers, Wine prefixes, installers, and native games rather than BIOS files." },
  "emulation": { "preferred_emulators": ["lutris"], "retroarch_cores": [] },
  "library_behavior": { "multidisc": false, "multidisc_format": null, "folder_based": true, "playlist_target_preference": "Lutris installer/config, desktop file, or launch script", "safe_archive_deletion_requires_launch_test": true },
  "frontend_notes": { "steamdeck": "Lutris entries may be wrapped by Steam shortcuts; preserve both launcher layers." },
  "safety": { "automation_level": "approval_required", "requires_backup": true, "do_not_store": ["account_data", "tokens", "license_keys", "save_data"], "notes": ["Do not edit Lutris game config, prefixes, or install paths automatically."] },
  "notes": ["Lutris repairs need launcher database/config context and should be backup-first."]
}
