{
  "id": "model2",
  "name": "Sega Model 2",
  "category": "arcade",
  "manufacturer": "Sega",
  "sources": [
    {
      "type": "docs",
      "url": "https://docs.mamedev.org/",
      "last_reviewed": "2026-04-29",
      "confidence": "medium"
    },
    {
      "type": "other",
      "url": "https://segaretro.org/Sega_Model_2",
      "last_reviewed": "2026-04-29",
      "confidence": "medium"
    }
  ],
  "aliases": {
    "folder_ids": [
      "model2",
      "sega-model-2"
    ],
    "frontend_ids": [
      "model2"
    ],
    "region_ids": [],
    "equivalent_system_ids": []
  },
  "formats": {
    "preferred": [
      ".zip"
    ],
    "supported": [
      ".zip"
    ],
    "descriptor_files": [],
    "archive_formats": [
      ".zip"
    ]
  },
  "bios": {
    "required": true,
    "common_files": [],
    "notes": "BIOS and device ROM requirements depend on emulator, title, and romset version."
  },
  "emulation": {
    "preferred_emulators": [
      "model2-emulator",
      "mame"
    ],
    "retroarch_cores": [
      "mame"
    ]
  },
  "library_behavior": {
    "romset_version_sensitive": true,
    "do_not_unzip_roms_by_default": true,
    "parent_clone_model": true
  },
  "frontend_notes": {
    "windows": "The classic Model 2 Emulator is Windows-oriented; other platforms commonly rely on MAME with compatibility caveats."
  },
  "safety": {
    "automation_level": "dry_run_only",
    "requires_backup": true,
    "do_not_store": [
      "bios_roms",
      "rom_payloads"
    ],
    "notes": [
      "Keep Model 2 sets read-only unless the user supplies exact emulator and romset version context."
    ]
  },
  "quirks": [
    "mame-romset-version"
  ],
  "notes": [
    "Compatibility and emulator choice are more variable than for cartridge systems."
  ]
}
