{"id":"fallout2-ce","name":"Fallout 2 Community Edition","category":"engine","manufacturer":"Community","sources":[{"type":"github","url":"https://github.com/alexbatalov/fallout2-ce","last_reviewed":"2026-04-29","confidence":"medium"}],"formats":{"preferred":[".sh",".desktop"],"supported":["folder",".sh",".desktop",".bat",".cmd",".lnk",".url",".exe",".zip",".7z"],"descriptor_files":[".sh",".desktop",".bat",".cmd",".lnk",".url"],"archive_formats":[".zip",".7z"]},"bios":{"required":false,"common_files":[],"notes":"Engine target; no BIOS files."},"emulation":{"preferred_emulators":["os-shell","retroarch"],"retroarch_cores":[]},"library_behavior":{"multidisc":false,"multidisc_format":null,"folder_based":true,"playlist_target_preference":"launcher script or Fallout 2 data folder","safe_archive_deletion_requires_launch_test":true},"safety":{"automation_level":"approval_required","requires_backup":true,"do_not_store":["commercial_game_data","save_data"],"notes":["Preserve data files and saves."]},"notes":["Fallout 2 engine bucket."]}
