{"id":"tyrian","name":"OpenTyrian","category":"engine","manufacturer":"OpenTyrian community","sources":[{"type":"homepage","url":"https://github.com/opentyrian/opentyrian","last_reviewed":"2026-04-29","confidence":"medium"}],"formats":{"preferred":["folder",".sh",".desktop"],"supported":["folder",".sh",".desktop",".bat",".cmd",".lnk",".url",".exe",".zip",".7z"],"descriptor_files":[".sh",".desktop",".bat",".cmd",".lnk",".url"],"archive_formats":[".zip",".7z"]},"bios":{"required":false,"common_files":[],"notes":"Open-source engine/game-data entry; no BIOS files."},"emulation":{"preferred_emulators":["os-shell","retroarch"],"retroarch_cores":[]},"library_behavior":{"multidisc":false,"multidisc_format":null,"folder_based":true,"playlist_target_preference":"launcher script or game-data folder","safe_archive_deletion_requires_launch_test":true},"safety":{"automation_level":"approval_required","requires_backup":true,"do_not_store":["commercial_game_data","save_data","user_config"],"notes":["Preserve data files, config, and save/progression files."]},"notes":["Source-port style content; verify game data adjacency before repairs."]}
