{"id":"commanderx16","name":"Commander X16","category":"computer","manufacturer":"Commander X16 project","sources":[{"type":"homepage","url":"https://www.commanderx16.com/","last_reviewed":"2026-04-29","confidence":"medium"}],"formats":{"preferred":[".prg"],"supported":[".prg",".bas",".bin",".rom",".d64",".zip",".7z"],"descriptor_files":[],"archive_formats":[".zip",".7z"]},"bios":{"required":true,"common_files":[],"notes":"Emulator ROM/build requirements vary by emulator version."},"emulation":{"preferred_emulators":["retroarch"],"retroarch_cores":[]},"library_behavior":{"multidisc":false,"multidisc_format":null,"folder_based":true,"playlist_target_preference":"program or disk image","safe_archive_deletion_requires_launch_test":true},"safety":{"automation_level":"approval_required","requires_backup":true,"do_not_store":["machine_roms","rom_payloads"],"notes":["Emulator version and ROM revision can affect compatibility."]},"notes":["Modern retro-computer target."]}
