{"id":"sc3000","name":"Sega SC-3000","category":"computer","manufacturer":"Sega","sources":[{"type":"docs","url":"https://docs.libretro.com/","last_reviewed":"2026-04-29","confidence":"low"}],"formats":{"preferred":[".bin",".rom"],"supported":[".bin",".rom",".sg",".sc",".zip",".7z",".iso",".chd"],"disc_formats":[".iso",".chd"],"archive_formats":[".zip",".7z"]},"bios":{"required":false,"common_files":[],"notes":"No project-confirmed BIOS requirement in current normalized data."},"emulation":{"preferred_emulators":["retroarch"],"retroarch_cores":[]},"library_behavior":{"multidisc":false,"multidisc_format":null,"folder_based":false,"playlist_target_preference":"ROM image","safe_archive_deletion_requires_launch_test":true},"safety":{"automation_level":"approval_required","requires_backup":true,"do_not_store":["save_data","bios_files"],"notes":["Computer-family media and boot behavior can vary; do not store machine ROMs."]},"notes":["Low-confidence static backfill; verify exact emulator/core support before automation."]}
