{"id":"pcarcade","name":"PC Arcade","category":"launcher","manufacturer":"Various","sources":[{"type":"docs","url":"https://docs.libretro.com/","last_reviewed":"2026-04-29","confidence":"low"}],"formats":{"preferred":[".sh",".desktop","folder"],"supported":["folder",".sh",".desktop",".bat",".cmd",".lnk",".url",".exe",".zip",".7z",".iso",".chd"],"descriptor_files":[".sh",".desktop",".bat",".cmd",".lnk",".url"],"disc_formats":[".iso",".chd"],"archive_formats":[".zip",".7z"]},"bios":{"required":false,"common_files":[],"notes":"Launcher bucket; no BIOS files."},"emulation":{"preferred_emulators":["os-shell","retroarch"],"retroarch_cores":[]},"library_behavior":{"multidisc":false,"multidisc_format":null,"folder_based":true,"playlist_target_preference":"launcher script, shortcut, or installed game folder","safe_archive_deletion_requires_launch_test":true},"safety":{"automation_level":"approval_required","requires_backup":true,"do_not_store":["commercial_game_data","save_data","account_data","user_config"],"notes":["Preserve installed game data, launcher arguments, saves, and working directories."]},"notes":["Broad PC arcade/native-game bucket; do not infer safe moves or deletion from extension alone."]}
