{
  "id": "lutro",
  "name": "Lutro",
  "category": "engine",
  "manufacturer": "Libretro community",
  "sources": [{ "type": "github", "url": "https://github.com/libretro/libretro-lutro", "last_reviewed": "2026-04-29", "confidence": "medium" }],
  "formats": { "preferred": [".lua", ".love"], "supported": [".zip", ".7z", ".lua", ".love", ".png", ".p8", ".tic"], "descriptor_files": [".lua"], "archive_formats": [".zip", ".7z"] },
  "bios": { "required": false, "common_files": [], "notes": "Lutro content is Libretro/Lua runtime content rather than BIOS-based emulation." },
  "emulation": { "preferred_emulators": ["retroarch"], "retroarch_cores": ["lutro"] },
  "library_behavior": { "multidisc": false, "multidisc_format": null, "folder_based": true, "playlist_target_preference": "Lua entry point or package folder", "safe_archive_deletion_requires_launch_test": true },
  "safety": { "automation_level": "dry_run_only", "requires_backup": true, "do_not_store": ["rom_payloads"], "notes": ["Do not flatten package folders or rewrite Lua-relative paths automatically."] },
  "notes": ["Runtime target with folder/package sidecar assumptions."]
}
